Loading CAPTCHA dataset...
Found 10000 images
Loading images: 100%|███████████████████████████████████████████████████████████████████████████████████████████████████████████████████████████████████████████████████████████████████████████████████████████████████████████████████████████████████████████████████████████████████████████| 10000/10000 [00:03<00:00, 3149.79it/s]
Successfully loaded 10000 images

Total samples: 10000
Label lengths: [10]
  10 characters: 10000 samples (100.0%)
Unique characters: 62
Character set: 0123456789ABCDEFGHIJKLMNOPQRSTUVWXYZabcdefghijklmnopqrstuvwxyz

Encoder classes (including blank): 63

Dataset split:
  Training: 6999 samples
  Validation: 2001 samples
  Test: 1000 samples
Model parameters: 5,787,391

Starting training...
Training on: cuda
Epoch 1/60: 100%|████████████████████████████████████████████████████████████████████████████████████████████████████████████████████████████████████████████████████████████████████████████████████████████████████████████████████████████████████████████████████████████████████████| 219/219 [00:03<00:00, 72.96it/s, loss=4.2196]

Epoch 1: Train Loss=4.3122, Val Loss=4.2285, Val Acc=0.0000, LR=0.001000
Epoch 2/60: 100%|████████████████████████████████████████████████████████████████████████████████████████████████████████████████████████████████████████████████████████████████████████████████████████████████████████████████████████████████████████████████████████████████████████| 219/219 [00:02<00:00, 76.49it/s, loss=3.3373] 

Epoch 2: Train Loss=4.0357, Val Loss=3.2146, Val Acc=0.0000, LR=0.001000
Epoch 3/60: 100%|████████████████████████████████████████████████████████████████████████████████████████████████████████████████████████████████████████████████████████████████████████████████████████████████████████████████████████████████████████████████████████████████████████| 219/219 [00:02<00:00, 80.37it/s, loss=2.6035] 

Epoch 3: Train Loss=2.8885, Val Loss=2.4088, Val Acc=0.0000, LR=0.001000
Epoch 4/60: 100%|████████████████████████████████████████████████████████████████████████████████████████████████████████████████████████████████████████████████████████████████████████████████████████████████████████████████████████████████████████████████████████████████████████| 219/219 [00:02<00:00, 79.32it/s, loss=1.7611] 

Epoch 4: Train Loss=2.0828, Val Loss=1.4790, Val Acc=0.0005, LR=0.001000
Saved best model with accuracy: 0.0005
Epoch 5/60: 100%|████████████████████████████████████████████████████████████████████████████████████████████████████████████████████████████████████████████████████████████████████████████████████████████████████████████████████████████████████████████████████████████████████████| 219/219 [00:02<00:00, 82.21it/s, loss=1.4959] 

Epoch 5: Train Loss=1.4373, Val Loss=0.8840, Val Acc=0.0330, LR=0.001000
Saved best model with accuracy: 0.0330
Epoch 6/60: 100%|████████████████████████████████████████████████████████████████████████████████████████████████████████████████████████████████████████████████████████████████████████████████████████████████████████████████████████████████████████████████████████████████████████| 219/219 [00:02<00:00, 82.31it/s, loss=0.9571]

Epoch 6: Train Loss=0.9235, Val Loss=0.5362, Val Acc=0.1289, LR=0.001000
Saved best model with accuracy: 0.1289
Epoch 7/60: 100%|████████████████████████████████████████████████████████████████████████████████████████████████████████████████████████████████████████████████████████████████████████████████████████████████████████████████████████████████████████████████████████████████████████| 219/219 [00:02<00:00, 81.85it/s, loss=0.6416] 

Epoch 7: Train Loss=0.6235, Val Loss=0.3722, Val Acc=0.2654, LR=0.001000
Saved best model with accuracy: 0.2654
Epoch 8/60: 100%|████████████████████████████████████████████████████████████████████████████████████████████████████████████████████████████████████████████████████████████████████████████████████████████████████████████████████████████████████████████████████████████████████████| 219/219 [00:02<00:00, 81.20it/s, loss=0.4166] 

Epoch 8: Train Loss=0.4757, Val Loss=0.2980, Val Acc=0.3403, LR=0.001000
Saved best model with accuracy: 0.3403
Epoch 9/60: 100%|████████████████████████████████████████████████████████████████████████████████████████████████████████████████████████████████████████████████████████████████████████████████████████████████████████████████████████████████████████████████████████████████████████| 219/219 [00:02<00:00, 79.54it/s, loss=0.3488] 

Epoch 9: Train Loss=0.3792, Val Loss=0.2339, Val Acc=0.4398, LR=0.001000
Saved best model with accuracy: 0.4398
Epoch 10/60: 100%|███████████████████████████████████████████████████████████████████████████████████████████████████████████████████████████████████████████████████████████████████████████████████████████████████████████████████████████████████████████████████████████████████████| 219/219 [00:02<00:00, 80.53it/s, loss=0.3618] 

Epoch 10: Train Loss=0.3097, Val Loss=0.1924, Val Acc=0.5072, LR=0.001000
Saved best model with accuracy: 0.5072
Epoch 11/60: 100%|███████████████████████████████████████████████████████████████████████████████████████████████████████████████████████████████████████████████████████████████████████████████████████████████████████████████████████████████████████████████████████████████████████| 219/219 [00:02<00:00, 80.73it/s, loss=0.3016] 

Epoch 11: Train Loss=0.2638, Val Loss=0.1756, Val Acc=0.5272, LR=0.001000
Saved best model with accuracy: 0.5272
Epoch 12/60: 100%|███████████████████████████████████████████████████████████████████████████████████████████████████████████████████████████████████████████████████████████████████████████████████████████████████████████████████████████████████████████████████████████████████████| 219/219 [00:02<00:00, 80.38it/s, loss=0.1718] 

Epoch 12: Train Loss=0.2302, Val Loss=0.1451, Val Acc=0.6047, LR=0.001000
Saved best model with accuracy: 0.6047
Epoch 13/60: 100%|███████████████████████████████████████████████████████████████████████████████████████████████████████████████████████████████████████████████████████████████████████████████████████████████████████████████████████████████████████████████████████████████████████| 219/219 [00:02<00:00, 82.27it/s, loss=0.1887] 

Epoch 13: Train Loss=0.2073, Val Loss=0.1398, Val Acc=0.6122, LR=0.001000
Saved best model with accuracy: 0.6122
Epoch 14/60: 100%|███████████████████████████████████████████████████████████████████████████████████████████████████████████████████████████████████████████████████████████████████████████████████████████████████████████████████████████████████████████████████████████████████████| 219/219 [00:02<00:00, 81.99it/s, loss=0.1206] 

Epoch 14: Train Loss=0.1763, Val Loss=0.1519, Val Acc=0.5987, LR=0.001000
Epoch 15/60: 100%|███████████████████████████████████████████████████████████████████████████████████████████████████████████████████████████████████████████████████████████████████████████████████████████████████████████████████████████████████████████████████████████████████████| 219/219 [00:02<00:00, 82.04it/s, loss=0.1925] 

Epoch 15: Train Loss=0.1663, Val Loss=0.1160, Val Acc=0.6677, LR=0.001000
Saved best model with accuracy: 0.6677
Epoch 16/60: 100%|███████████████████████████████████████████████████████████████████████████████████████████████████████████████████████████████████████████████████████████████████████████████████████████████████████████████████████████████████████████████████████████████████████| 219/219 [00:02<00:00, 82.58it/s, loss=0.0795] 

Epoch 16: Train Loss=0.1467, Val Loss=0.1193, Val Acc=0.6792, LR=0.001000
Saved best model with accuracy: 0.6792
Epoch 17/60: 100%|███████████████████████████████████████████████████████████████████████████████████████████████████████████████████████████████████████████████████████████████████████████████████████████████████████████████████████████████████████████████████████████████████████| 219/219 [00:02<00:00, 80.41it/s, loss=0.1544] 

Epoch 17: Train Loss=0.1321, Val Loss=0.1057, Val Acc=0.7076, LR=0.001000
Saved best model with accuracy: 0.7076
Epoch 18/60: 100%|███████████████████████████████████████████████████████████████████████████████████████████████████████████████████████████████████████████████████████████████████████████████████████████████████████████████████████████████████████████████████████████████████████| 219/219 [00:02<00:00, 80.35it/s, loss=0.1002] 

Epoch 18: Train Loss=0.1210, Val Loss=0.1102, Val Acc=0.6992, LR=0.001000
Epoch 19/60: 100%|███████████████████████████████████████████████████████████████████████████████████████████████████████████████████████████████████████████████████████████████████████████████████████████████████████████████████████████████████████████████████████████████████████| 219/219 [00:02<00:00, 80.24it/s, loss=0.1630] 

Epoch 19: Train Loss=0.1082, Val Loss=0.0914, Val Acc=0.7491, LR=0.001000
Saved best model with accuracy: 0.7491
Epoch 20/60: 100%|███████████████████████████████████████████████████████████████████████████████████████████████████████████████████████████████████████████████████████████████████████████████████████████████████████████████████████████████████████████████████████████████████████| 219/219 [00:02<00:00, 81.27it/s, loss=0.1143] 

Epoch 20: Train Loss=0.1004, Val Loss=0.0861, Val Acc=0.7676, LR=0.001000
Saved best model with accuracy: 0.7676
Epoch 21/60: 100%|███████████████████████████████████████████████████████████████████████████████████████████████████████████████████████████████████████████████████████████████████████████████████████████████████████████████████████████████████████████████████████████████████████| 219/219 [00:02<00:00, 83.53it/s, loss=0.1343] 

Epoch 21: Train Loss=0.0984, Val Loss=0.0768, Val Acc=0.7856, LR=0.001000
Saved best model with accuracy: 0.7856
Epoch 22/60: 100%|███████████████████████████████████████████████████████████████████████████████████████████████████████████████████████████████████████████████████████████████████████████████████████████████████████████████████████████████████████████████████████████████████████| 219/219 [00:02<00:00, 82.04it/s, loss=0.1789] 

Epoch 22: Train Loss=0.0931, Val Loss=0.0728, Val Acc=0.8031, LR=0.001000
Saved best model with accuracy: 0.8031
Epoch 23/60: 100%|███████████████████████████████████████████████████████████████████████████████████████████████████████████████████████████████████████████████████████████████████████████████████████████████████████████████████████████████████████████████████████████████████████| 219/219 [00:02<00:00, 83.52it/s, loss=0.0498] 

Epoch 23: Train Loss=0.0813, Val Loss=0.0772, Val Acc=0.7946, LR=0.001000
Epoch 24/60: 100%|███████████████████████████████████████████████████████████████████████████████████████████████████████████████████████████████████████████████████████████████████████████████████████████████████████████████████████████████████████████████████████████████████████| 219/219 [00:02<00:00, 82.64it/s, loss=0.0761] 

Epoch 24: Train Loss=0.0742, Val Loss=0.0678, Val Acc=0.8201, LR=0.001000
Saved best model with accuracy: 0.8201
Epoch 25/60: 100%|███████████████████████████████████████████████████████████████████████████████████████████████████████████████████████████████████████████████████████████████████████████████████████████████████████████████████████████████████████████████████████████████████████| 219/219 [00:02<00:00, 79.52it/s, loss=0.0584] 

Epoch 25: Train Loss=0.0710, Val Loss=0.0796, Val Acc=0.8091, LR=0.001000
Epoch 26/60: 100%|███████████████████████████████████████████████████████████████████████████████████████████████████████████████████████████████████████████████████████████████████████████████████████████████████████████████████████████████████████████████████████████████████████| 219/219 [00:02<00:00, 80.22it/s, loss=0.0949] 

Epoch 26: Train Loss=0.0641, Val Loss=0.0716, Val Acc=0.8236, LR=0.001000
Saved best model with accuracy: 0.8236
Epoch 27/60: 100%|███████████████████████████████████████████████████████████████████████████████████████████████████████████████████████████████████████████████████████████████████████████████████████████████████████████████████████████████████████████████████████████████████████| 219/219 [00:02<00:00, 81.18it/s, loss=0.0282] 

Epoch 27: Train Loss=0.0588, Val Loss=0.0660, Val Acc=0.8421, LR=0.001000
Saved best model with accuracy: 0.8421
Epoch 28/60: 100%|███████████████████████████████████████████████████████████████████████████████████████████████████████████████████████████████████████████████████████████████████████████████████████████████████████████████████████████████████████████████████████████████████████| 219/219 [00:02<00:00, 81.91it/s, loss=0.0328] 

Epoch 28: Train Loss=0.0549, Val Loss=0.0678, Val Acc=0.8341, LR=0.001000
Epoch 29/60: 100%|███████████████████████████████████████████████████████████████████████████████████████████████████████████████████████████████████████████████████████████████████████████████████████████████████████████████████████████████████████████████████████████████████████| 219/219 [00:02<00:00, 81.48it/s, loss=0.0423] 

Epoch 29: Train Loss=0.0625, Val Loss=0.0667, Val Acc=0.8456, LR=0.001000
Saved best model with accuracy: 0.8456
Epoch 30/60: 100%|███████████████████████████████████████████████████████████████████████████████████████████████████████████████████████████████████████████████████████████████████████████████████████████████████████████████████████████████████████████████████████████████████████| 219/219 [00:02<00:00, 82.18it/s, loss=0.0672] 

Epoch 30: Train Loss=0.0499, Val Loss=0.0656, Val Acc=0.8446, LR=0.001000
Epoch 31/60: 100%|███████████████████████████████████████████████████████████████████████████████████████████████████████████████████████████████████████████████████████████████████████████████████████████████████████████████████████████████████████████████████████████████████████| 219/219 [00:02<00:00, 82.62it/s, loss=0.0303] 

Epoch 31: Train Loss=0.0483, Val Loss=0.0687, Val Acc=0.8281, LR=0.001000
Epoch 32/60: 100%|███████████████████████████████████████████████████████████████████████████████████████████████████████████████████████████████████████████████████████████████████████████████████████████████████████████████████████████████████████████████████████████████████████| 219/219 [00:02<00:00, 81.32it/s, loss=0.0337] 

Epoch 32: Train Loss=0.0447, Val Loss=0.0657, Val Acc=0.8401, LR=0.001000
Epoch 33/60: 100%|███████████████████████████████████████████████████████████████████████████████████████████████████████████████████████████████████████████████████████████████████████████████████████████████████████████████████████████████████████████████████████████████████████| 219/219 [00:02<00:00, 80.14it/s, loss=0.0738] 

Epoch 33: Train Loss=0.0449, Val Loss=0.0654, Val Acc=0.8416, LR=0.001000
Epoch 34/60: 100%|███████████████████████████████████████████████████████████████████████████████████████████████████████████████████████████████████████████████████████████████████████████████████████████████████████████████████████████████████████████████████████████████████████| 219/219 [00:02<00:00, 81.26it/s, loss=0.0146] 

Epoch 34: Train Loss=0.0470, Val Loss=0.0708, Val Acc=0.8381, LR=0.001000
Epoch 35/60: 100%|███████████████████████████████████████████████████████████████████████████████████████████████████████████████████████████████████████████████████████████████████████████████████████████████████████████████████████████████████████████████████████████████████████| 219/219 [00:02<00:00, 80.35it/s, loss=0.0261] 

Epoch 35: Train Loss=0.0434, Val Loss=0.0659, Val Acc=0.8446, LR=0.001000
Epoch 36/60: 100%|███████████████████████████████████████████████████████████████████████████████████████████████████████████████████████████████████████████████████████████████████████████████████████████████████████████████████████████████████████████████████████████████████████| 219/219 [00:02<00:00, 80.82it/s, loss=0.0520] 

Epoch 36: Train Loss=0.0296, Val Loss=0.0607, Val Acc=0.8626, LR=0.000500
Saved best model with accuracy: 0.8626
Epoch 37/60: 100%|███████████████████████████████████████████████████████████████████████████████████████████████████████████████████████████████████████████████████████████████████████████████████████████████████████████████████████████████████████████████████████████████████████| 219/219 [00:02<00:00, 80.70it/s, loss=0.0314] 

Epoch 37: Train Loss=0.0241, Val Loss=0.0589, Val Acc=0.8706, LR=0.000500
Saved best model with accuracy: 0.8706
Epoch 38/60: 100%|███████████████████████████████████████████████████████████████████████████████████████████████████████████████████████████████████████████████████████████████████████████████████████████████████████████████████████████████████████████████████████████████████████| 219/219 [00:02<00:00, 82.92it/s, loss=0.0272] 

Epoch 38: Train Loss=0.0222, Val Loss=0.0565, Val Acc=0.8796, LR=0.000500
Saved best model with accuracy: 0.8796
Epoch 39/60: 100%|███████████████████████████████████████████████████████████████████████████████████████████████████████████████████████████████████████████████████████████████████████████████████████████████████████████████████████████████████████████████████████████████████████| 219/219 [00:02<00:00, 83.50it/s, loss=0.0341] 

Epoch 39: Train Loss=0.0209, Val Loss=0.0537, Val Acc=0.8866, LR=0.000500
Saved best model with accuracy: 0.8866
Epoch 40/60: 100%|███████████████████████████████████████████████████████████████████████████████████████████████████████████████████████████████████████████████████████████████████████████████████████████████████████████████████████████████████████████████████████████████████████| 219/219 [00:02<00:00, 80.95it/s, loss=0.0406] 

Epoch 40: Train Loss=0.0187, Val Loss=0.0646, Val Acc=0.8756, LR=0.000500
Epoch 41/60: 100%|███████████████████████████████████████████████████████████████████████████████████████████████████████████████████████████████████████████████████████████████████████████████████████████████████████████████████████████████████████████████████████████████████████| 219/219 [00:02<00:00, 79.43it/s, loss=0.0357] 

Epoch 41: Train Loss=0.0198, Val Loss=0.0595, Val Acc=0.8756, LR=0.000500
Epoch 42/60: 100%|███████████████████████████████████████████████████████████████████████████████████████████████████████████████████████████████████████████████████████████████████████████████████████████████████████████████████████████████████████████████████████████████████████| 219/219 [00:02<00:00, 81.41it/s, loss=0.0316] 

Epoch 42: Train Loss=0.0180, Val Loss=0.0607, Val Acc=0.8786, LR=0.000500
Epoch 43/60: 100%|███████████████████████████████████████████████████████████████████████████████████████████████████████████████████████████████████████████████████████████████████████████████████████████████████████████████████████████████████████████████████████████████████████| 219/219 [00:02<00:00, 81.46it/s, loss=0.0201] 

Epoch 43: Train Loss=0.0165, Val Loss=0.0600, Val Acc=0.8811, LR=0.000500
Epoch 44/60: 100%|███████████████████████████████████████████████████████████████████████████████████████████████████████████████████████████████████████████████████████████████████████████████████████████████████████████████████████████████████████████████████████████████████████| 219/219 [00:02<00:00, 80.66it/s, loss=0.0151] 

Epoch 44: Train Loss=0.0177, Val Loss=0.0577, Val Acc=0.8836, LR=0.000500
Epoch 45/60: 100%|███████████████████████████████████████████████████████████████████████████████████████████████████████████████████████████████████████████████████████████████████████████████████████████████████████████████████████████████████████████████████████████████████████| 219/219 [00:02<00:00, 82.48it/s, loss=0.0048] 

Epoch 45: Train Loss=0.0188, Val Loss=0.0631, Val Acc=0.8831, LR=0.000500
Epoch 46/60: 100%|███████████████████████████████████████████████████████████████████████████████████████████████████████████████████████████████████████████████████████████████████████████████████████████████████████████████████████████████████████████████████████████████████████| 219/219 [00:02<00:00, 82.91it/s, loss=0.0266] 

Epoch 46: Train Loss=0.0155, Val Loss=0.0582, Val Acc=0.8936, LR=0.000250
Saved best model with accuracy: 0.8936
Epoch 47/60: 100%|███████████████████████████████████████████████████████████████████████████████████████████████████████████████████████████████████████████████████████████████████████████████████████████████████████████████████████████████████████████████████████████████████████| 219/219 [00:02<00:00, 82.26it/s, loss=0.0290] 

Epoch 47: Train Loss=0.0122, Val Loss=0.0595, Val Acc=0.8931, LR=0.000250
Epoch 48/60: 100%|███████████████████████████████████████████████████████████████████████████████████████████████████████████████████████████████████████████████████████████████████████████████████████████████████████████████████████████████████████████████████████████████████████| 219/219 [00:02<00:00, 80.31it/s, loss=0.0059] 

Epoch 48: Train Loss=0.0106, Val Loss=0.0595, Val Acc=0.8911, LR=0.000250
Epoch 49/60: 100%|███████████████████████████████████████████████████████████████████████████████████████████████████████████████████████████████████████████████████████████████████████████████████████████████████████████████████████████████████████████████████████████████████████| 219/219 [00:02<00:00, 81.17it/s, loss=0.0078] 

Epoch 49: Train Loss=0.0093, Val Loss=0.0576, Val Acc=0.8941, LR=0.000250
Saved best model with accuracy: 0.8941
Epoch 50/60: 100%|███████████████████████████████████████████████████████████████████████████████████████████████████████████████████████████████████████████████████████████████████████████████████████████████████████████████████████████████████████████████████████████████████████| 219/219 [00:02<00:00, 81.02it/s, loss=0.0010] 

Epoch 50: Train Loss=0.0108, Val Loss=0.0595, Val Acc=0.8896, LR=0.000250
Epoch 51/60: 100%|███████████████████████████████████████████████████████████████████████████████████████████████████████████████████████████████████████████████████████████████████████████████████████████████████████████████████████████████████████████████████████████████████████| 219/219 [00:02<00:00, 79.67it/s, loss=0.0048] 

Epoch 51: Train Loss=0.0106, Val Loss=0.0618, Val Acc=0.8906, LR=0.000250
Epoch 52/60: 100%|███████████████████████████████████████████████████████████████████████████████████████████████████████████████████████████████████████████████████████████████████████████████████████████████████████████████████████████████████████████████████████████████████████| 219/219 [00:02<00:00, 80.31it/s, loss=0.0041] 

Epoch 52: Train Loss=0.0092, Val Loss=0.0627, Val Acc=0.8891, LR=0.000250
Epoch 53/60: 100%|███████████████████████████████████████████████████████████████████████████████████████████████████████████████████████████████████████████████████████████████████████████████████████████████████████████████████████████████████████████████████████████████████████| 219/219 [00:02<00:00, 83.30it/s, loss=0.0104] 

Epoch 53: Train Loss=0.0095, Val Loss=0.0639, Val Acc=0.8856, LR=0.000250
Epoch 54/60: 100%|███████████████████████████████████████████████████████████████████████████████████████████████████████████████████████████████████████████████████████████████████████████████████████████████████████████████████████████████████████████████████████████████████████| 219/219 [00:02<00:00, 83.09it/s, loss=0.0016] 

Epoch 54: Train Loss=0.0089, Val Loss=0.0634, Val Acc=0.8896, LR=0.000250
Epoch 55/60: 100%|███████████████████████████████████████████████████████████████████████████████████████████████████████████████████████████████████████████████████████████████████████████████████████████████████████████████████████████████████████████████████████████████████████| 219/219 [00:02<00:00, 81.06it/s, loss=0.0097] 

Epoch 55: Train Loss=0.0085, Val Loss=0.0647, Val Acc=0.8906, LR=0.000250
Epoch 56/60: 100%|███████████████████████████████████████████████████████████████████████████████████████████████████████████████████████████████████████████████████████████████████████████████████████████████████████████████████████████████████████████████████████████████████████| 219/219 [00:02<00:00, 81.22it/s, loss=0.0014] 

Epoch 56: Train Loss=0.0076, Val Loss=0.0643, Val Acc=0.8926, LR=0.000125
Epoch 57/60: 100%|███████████████████████████████████████████████████████████████████████████████████████████████████████████████████████████████████████████████████████████████████████████████████████████████████████████████████████████████████████████████████████████████████████| 219/219 [00:02<00:00, 80.76it/s, loss=0.0005] 

Epoch 57: Train Loss=0.0064, Val Loss=0.0622, Val Acc=0.8966, LR=0.000125
Saved best model with accuracy: 0.8966
Epoch 58/60: 100%|███████████████████████████████████████████████████████████████████████████████████████████████████████████████████████████████████████████████████████████████████████████████████████████████████████████████████████████████████████████████████████████████████████| 219/219 [00:02<00:00, 80.29it/s, loss=0.0185] 

Epoch 58: Train Loss=0.0066, Val Loss=0.0620, Val Acc=0.8966, LR=0.000125
Epoch 59/60: 100%|███████████████████████████████████████████████████████████████████████████████████████████████████████████████████████████████████████████████████████████████████████████████████████████████████████████████████████████████████████████████████████████████████████| 219/219 [00:02<00:00, 80.53it/s, loss=0.0062] 

Epoch 59: Train Loss=0.0060, Val Loss=0.0627, Val Acc=0.8941, LR=0.000125
Epoch 60/60: 100%|███████████████████████████████████████████████████████████████████████████████████████████████████████████████████████████████████████████████████████████████████████████████████████████████████████████████████████████████████████████████████████████████████████| 219/219 [00:02<00:00, 82.43it/s, loss=0.0014] 

Epoch 60: Train Loss=0.0059, Val Loss=0.0626, Val Acc=0.9000, LR=0.000125
Saved best model with accuracy: 0.9000

Training complete! Best validation accuracy: 0.9000
Evaluating on test set...
100%|██████████████████████████████████████████████████████████████████████████████████████████████████████████████████████████████████████████████████████████████████████████████████████████████████████████████████████████████████████████████████████████████████████████████████████████████████| 32/32 [00:00<00:00, 159.16it/s] 

=== Test Set Results ===
Captcha-level Accuracy: 0.8800 (880/1000)
Character-level Accuracy: 0.9866
Average Confidence: 0.9977
Total Errors: 120

=== Error Analysis ===
Total errors: 120

Top 10 character confusions:
  I → l: 13 times
  I → 1: 13 times
  l → i: 6 times
  1 → l: 6 times
  l → I: 5 times
  o → e: 4 times
  G → C: 3 times
  J → j: 3 times
  1 → I: 3 times
  i → I: 3 times

Most error-prone characters (top 10):
  '1': appears in 53 errors (44.2% of errors)
  '7': appears in 44 errors (36.7% of errors)
  '4': appears in 41 errors (34.2% of errors)
  '0': appears in 41 errors (34.2% of errors)
  '5': appears in 40 errors (33.3% of errors)
  '9': appears in 40 errors (33.3% of errors)
  'I': appears in 37 errors (30.8% of errors)
  '8': appears in 37 errors (30.8% of errors)
  '3': appears in 36 errors (30.0% of errors)
  '2': appears in 33 errors (27.5% of errors)

Confidence analysis:
  High confidence errors (>0.8): 120 (100.0%)
  Low confidence errors (<0.5): 0 (0.0%)
  Average error confidence: 0.993

Visualizing sample predictions...
PS C:\Users\dawha\AIFinal> 